title,price,thumbnail,category,description,url,author
"Odbijte me to volim","770 rsd","https://www.korisnaknjiga.com/photo/books0001/p000075c0.jpg","Knjige o biznisu","U knjizi Odbijte me - to volim naučite kako da:

    * Upotrebite 21 tajnu u procesu bez  odbijanja da postignete uspeh
    * Sprečite da NE preuzme kontrolu nad vašim životom
    * Ulaganjem u sebe budete nagrađeni životom kakav zaslužujete
    * Gubitnička opravdanja pretvorite u nadahnuća
    * Upotrebite neograničenu moć pitanja koja počinju sa ZAŠTO
    * Ojačajte svoje samopouzdanje i samopoštovanje
    * Izgradite svoj put prema poslovnom i finansijskom uspehu","odbijte-me-to-volim-naslov-75","Džon Furman"
"Moć govora","1.100 rsd","https://www.korisnaknjiga.com/photo/books0001/p000070b0.jpg","Knjige o biznisu","Tokom dugog niza godina, Brajan Trejsi je proučavao tehnike najboljih govornika na svetu. U knjizi Moć govora on otkriva tajne najvećih govornika koje su se vremenom potvrdile u praksi, a koje vi možete da koristite da održite upečatljive govore, promocije, predavanja i prezentacije. Naučićete kako da govorite uverljivo, bilo na neformalnom sastanku ili pred grupom ljudi.

U ovoj knjizi naučićete kako da:

    * budete samopouzdani, pozitivni i opušteni pred publikom
    * od samog početka probudite i održite pažnju ljudi
    * koristite govor tela, tehnike modulacije glasa tako da zadržite interesovanje publike
    * napravite upečatljive prelaze od jedne do druge ključne tačke
    * završite govor efektno i autoritativno

Ova knjiga prevazilazi osnovne principe govorništva, upućujući vas u najmoćnije tajne impresionaranja publike, omogućavajući vam ne samo da efikasno komunicirate, već i da isto tako menjate mišljenja drugih o temama koje su suštinski važne za vaš uspeh.","moc-govora-naslov-70","Brajan Trejsi"
"Savremeno liderstvo","2.200 rsd","https://www.korisnaknjiga.com/photo/books0241/p240025b0.jpg","Knjige o biznisu","""Savremeno liderstvo"" Tatjane Janovac predstavlja sveobuhvatan i inovativan priručnik za razumevanje i primenu efektivnog vođstva u savremenom kontekstu, obuhvatajući dinamične promene i sve izraženije izazove u svetu liderstva.

 Ova knjiga je izuzetno značajna jer prvi put donosi integrisani pristup koji prevazilazi tradicionalne okvire menadžmenta, fokusirajući se na dubinsko proučavanje liderstva kao kompleksnog i dinamičnog procesa.

Janovac detaljno istražuje i konceptualizuje odnos između lidera i sledbenika, ističući ključne liderske potencijale, karakteristike i kompetencije. Kroz analizu emocionalnih sposobnosti i različitih modela liderstva, knjiga pruža sveobuhvatan pregled kako lideri mogu efektivno da utiču na svoje timove i organizacije. Posebno su zanimljive studije slučaja i praktični primeri iz stvarnog života, koji čitaocima omogućavaju da stečena znanja primene u stvarnim situacijama.

Autorka se takođe bavi analizom liderskih tehnika i vežbi za lični i profesionalni razvoj, uključujući upitnike, zadatke i primere koji su osmišljeni da unaprede liderske i menadžerske veštine, kritičko razmišljanje i racionalno odlučivanje. Poseban deo knjige posvećen je prikazima stilova vođstva mnogih istorijskih ličnosti, političara i uspešnih poslovnih ljudi, što pruža inspiraciju i smernice za izgradnju ličnog stila liderstva.

""Savremeno liderstvo"" namenjeno je širokom spektru čitalaca, uključujući menadžere, političare, lidere i sve one koji teže da postanu lideri, ali i sve zainteresovane za bolje razumevanje suštine liderstva i efektivnosti liderskih procesa. 
Janovac kroz analizu slaganja tipa ličnosti lidera i sledbenika, kao i kroz objašnjenje oblika ponašanja lidera i stilova liderstva, pruža dragocene uvide koji su ključni za kreiranje efektivnih liderskih strategija.

Tatjana Janovac, kao profesor na Fakultetu za primenjeni menadžment, ekonomiju i finansije i rukovodilac Centra za karijerno vođenje, donosi bogato iskustvo iz oblasti liderstva i menadžmenta. Njena angažovanost na predmetima poput Liderstva, Upravljanja ljudskim resursima, Organizacionog ponašanja i korporativne bezbednosti, kao i učešće na brojnim naučnim i stručnim skupovima, daju ovoj knjizi dodatnu težinu i verodostojnost.

Knjiga ""Savremeno liderstvo"" predstavlja neophodan vodič za sve one koji žele da unaprede svoje liderske veštine i postanu efikasniji i uspešniji lideri u savremenom svetu. 

Kroz ovaj detaljan i praktičan priručnik, Tatjana Janovac pruža alate i strategije koje omogućavaju liderima da se suoče sa izazovima i iskoriste prilike u dinamičnom okruženju, stvarajući održive i pozitivne promene u svojim organizacijama i zajednicama.","savremeno-liderstvo-naslov-240025","Tatjana Janovac"
"Životna strategija","880 rsd","https://www.korisnaknjiga.com/photo/books0234/p233084b0.jpg","Knjige o biznisu","Da biste preuzeli kontrolu nad svojim životom, osetili elan i zadovolјstvo zbog onoga što se dešava, potrebno je da se držite sopstvenog scenarija.


Svako rešava mnoštvo složenih zadataka: biti dobar roditelј, supružnik, nečije dete, uz to naporno raditi i po nekoliko poslova, čuvati zdravlјe, ne zanemarivati svoj duhovni svet, usavršavati se...


Stručnjak za strateški menadžment, korporativni direktor, predavač na više visokih obrazovnih ustanova, osnivač ruskog izdanja časopisa Forbs, Svjatoslav Birjulin, glavni poslovni konsultant za Istočnu Evropu i Centralnu Aziju, autor je i desetine izdanja iz oblasti poslovnog menadžmenta prevedenih na engleski i slovenački. U izdanju Životna strategija Birjulin nam otkriva plodotvorne tehnike primenjive na sva životna polјa: porodicu, prijatelјe, profesiju…","zivotna-strategija-naslov-233084","Svjatoslav Birjulin"
"Suvremeni menadžment: Vještine, sustavi i izazovi, meki povez","12.607 rsd","https://www.korisnaknjiga.com/photo/books0233/p232708b0.jpg","Knjige o biznisu","Knjiga je namijenjena studentima Ekonomskog fakulteta Sveučilišta u Zagrebu kao udžbenik za predmet Menadžment na III. godini studija. Sastoji se od 4 dijela i 17 poglavlja. Logički je strukturirana i postupno uvodi čitatelja u sve bitne aspekte suvremenog menadžmenta. Središnje mjesto u knjizi ima prvo poglavlje, koje nosi naziv Menadžerske vještine, jer doista, suvremeni menadžer mora odlično poznavati sve menadžerske vještine.

Njegova uspješnost u vještinama menadžmenta osposobljava ga za najizazovnije poslove i za rješavanje najsloženijih problema. Da bi menadžer bio uspješan u vještinama menadžmenta, on mora poznavati sustave, pristupe, tehnike i sredstva menadžmenta, što se obrađuje u drugom dijelu knjige. Treći dio knjige odnosi se na posebna područja menadžmenta, pa je izučavanje međukulturalnoga i međunarodnog menadžmenta te menadžmenta u globalnom okruženju potrebno i našim studentima koji se zapošljavaju i u globalnim organizacijama. Posljednje poglavlje Izazovi menadžmenta u XXI st. obrađuje teme poslovne i menadžerske etike i društvene odgovornosti kompanija, upravljanje znanjem i različitostima te ulogu žena u menadžmentu.


Knjiga je svojim sadržajem, širinom obuhvata tema, načinom obradbe materije, jasnoćom iznošenja vlastitih stajališta autora te logičnim promišljanjem svih tema izuzetno vrijedno djelo koje nadmašuje svoju namjenu. Autorski tim podario je svojim studentima, menadžerima u svim organizacijama i na svim razinama menadžmenta te svim zainteresiranim čitateljima izuzetno vrijednu knjigu, za koju se može tvrditi da je najvrjednije djelo te vrste u nas.


prof. dr. sc. Marin Buble, iz recenzije



Iz sadržaja:


I. Menadžerske vještine
II. Menadžerski sustavi, pristupi, tehnike i alati
III. Posebna područja menadžmenta
IV.Izazovi menadžmenta u XXI stoljeću","suvremeni-menadzment-vjestine-sustavi-i-izazovi-meki-povez-naslov-232708","Fikreta Bahtijarević-Šiber, Pere Sikavica, Nina Pološki Vokić"
"Održivi biznis planovi u agrobiznisu","2.500 rsd","https://www.korisnaknjiga.com/photo/books0233/p232674b0.jpg","Knjige o biznisu","Knjiga Održivi biznis planovi u agrobiznisu napisana je i osmišljena tako da poznaje percepciju preduzetnika prema značaju plana u maloj i srednjoj agrobiznis firmi ili same startap ideje. Analizira izazove dok vas vodi kroz agrobiznis plan. Razmatra efekat suštinskih karakteristika održivog agrobiznis plana na uspeh.

U knjizi je istaknut ključni scenario agrobiznis plana i njegov značaj u sadašnjem takmičarskom dobu opstanka firme i uspešne realizacije poslovne ideje koja ne samo da treba biti održiva sa aspekta proizvodno-tehnoloških operacija već i sa poslovno-finansijskih.

Takođe, u knjizi možete pronaći smernice kako da koristite primarne i sekundarne podatke i informacije, počev od različitih kupaca, supermarketa, marketinških i PR agencija. Kao takva zamišljena je da je koriste studenti završnih godina i master studija agrobiznis menadžmenta, svakako agrobiznis menadžeri i oni koji pokreću startapove u oblasti agrobiznisa.

I u ovoj knjizi možete pronaći kompletne informacije o faktorima koji utiču na uspeh agrobiznis plana i pokazuje značaj biznis plana za male i srednje firme, pri čemu pruža i efikasnu platformu za dalja naučna i profesionalna istraživanja u ovoj oblasti. Saznaćete koja su vitalna, centralna i nezaobilazna pitanja i tačke koje treba analizirati uzimajući u obzir značaj različitih aktivnosti koje igraju značajnu ulogu u vođenju agrobiznis firme.


Kratak sadržaj:

Predgovor
Značaj biznis plana u sadašnjem dobu
Uvod u biznis plan

Poglavlje 1: Poslovno planiranje
Poglavlje 2: Situaciona analiza: snaga, slabosti, prilike i pretnje (SSPP)
Poglavlje 3: Finansijsko izveštavanje na farmi
Poglavlje 4: Finansijsko planiranje
Poglavlje 5: Analiza tržišta i poslovno planiranje
Poglavlje 6: Planiranje finansijskih tokova
Poglavlje 7: Finansijsko predviđanje i budžetiranje
Poglavlje 8: Kontrolna lista za agroindustrijske projekte
Poglavlje 9: Model biznis plana
Poglavlje 10: Pisanje biznis plana
Dodatak A - Primer poslovnog plana: Gal-Tech i Melanin
Dodatak B - MBA – Inc. izvršni rezime (MBA, Inc. Executive Summary)
Dodatak C - Elementi poslovnog plana: mala i srednja preduzeća
Dodatak D - EBRD-DIF program direktnih investicija u proizvodne kapacitete – inicijativa regionalnog razvoja u saradnji sa Euro Consultants S.A.
Dodatak E - Sistem koordinisanih analitičkih tabelarnih pregleda agrobiznis menadžmenta farme

Indeks pojmova
Beleška o autorima","odrzivi-biznis-planovi-u-agrobiznisu-naslov-232674","Paul Thompson, Branko Ž. Ljutić, Milan Lj. Stamatović"
"Ostvari to!","990 rsd","https://www.korisnaknjiga.com/photo/books0230/p229276b0.jpg","Knjige o biznisu","Make it happen!


Mala crna knjiga o tome kako da ostvarite ono što želite


Lazar Vuković kaže “Ja nisam poznato ime, Ja sam samo prosječna osoba, baš kao i ti… ili si možda daleko superiorniji od mene. Podijeliću sa vama kako sam uspio da napravim da se stvari dešavaju iz ničega…”

U knjizi nam Lazar opisuje od prodaje slatkiša u djetinjstvu na igralištu, prodaje igračaka u lancu prodavnica do rada sa članovima kraljevske porodice i savjetovanja svjetskih lidera.

Ovo je mala crna knjiga priča o tome kako je napravljena!","ostvari-to-naslov-229276","Lazar Vuković"
"Trenje","1.100 rsd","https://www.korisnaknjiga.com/photo/books0229/p228680b0.jpg","Knjige o biznisu","Ako želite da dodate vrednost, podstaknite ljude da rade za to

Trenje nije nešto što treba izbegavati. Uspešna preduzeća ne samo da razumeju razliku između dobrog i lošeg trenja, već i znaju kako da prihvate dozu dobrog trenja da bi stvorili veću vrednost. Pokazaćemo vam kako da iskoristite dobro trenje kako biste povećali angažovanje, značenje i ekskluzivnost.


Ova zadivljujuća knjiga razbila je moju iluziju da je presudna karakteristika odličnog proizvoda to da čini stvari što lakšim. Ako mislite da je eliminisanje svakog napora ključ dobrog dizajna, pripremite se da ponovo razmislite.

Adam Grant, autor bestselera br. 1 New York Times-a THINK AGAIN i voditelj TED podkasta WorkLife


Pomoću trenja, zapravo, hodamo. Bez trenja bismo pali na nos. Ako vodite posao, ako pokrećete proizvod ili uslugu, ova knjiga će vam pomoći da dodate pravu dozu trenja – tako da možete hodati (ili još bolje trčati) prema svom cilju. Izbegnite padanje, pročitajte je sada.

Čip Hit, autor bestselera New York Times-a Switch and Made to Stick, profesor na Stenfordskoj diplomskoj školi biznisa.","trenje-naslov-228680","Sun Ju, Dejv Birs"
"Dizanje organizacije","1.999 rsd","https://www.korisnaknjiga.com/photo/books0213/p212443b0.jpg","Knjige o biznisu","Iz recenzije:

„Najvažniji posao lidera jeste da motiviše i organizuje ljude. Kad sam prvi put pročitao ovu knjigu, uvideo sam koliko fokusiranost na procese i optimizaciju može biti pogrešna ukoliko se dizanje organizacije ne shvati kao uzdizanje ljudi. Organizovana je kao rečnik, pa vas stalno poziva da je listate. Kad god joj se vratite, bolje ćete razumeti kako je uspela da izgradi kult knjige koju svaki menadžer i svaki zaposleni treba da pročita.“

Bojan Leković, osnivač KupujemProdajem, autor knjige Medvedi na putu","dizanje-organizacije-naslov-212443","Robert Taunsend"
"Liderska strategija novog doba: Implementacija i kontrola","660 rsd","https://www.korisnaknjiga.com/photo/books0212/p211885b0.jpg","Knjige o biznisu","","liderska-strategija-novog-doba-implementacija-i-kontrola-naslov-211885","Tanja Milić"
"Kako voditi sebe i druge","5.165 rsd","https://www.korisnaknjiga.com/photo/books0211/p210313b0.jpg","Knjige o biznisu","Odlomak:

EMOCIONALNA INTELIGENCIJA POMAŽE VOĐAMA

Dugo se smatralo kako u organizaciji i poslovanju emocije nemaju svoje mjesto. Međutim, istraživanja su pokazala da iskazivanje pozitivnih emocija može imati vrlo pozitivne učinke. S druge strane, zanemarivanje emocija može uzrokovati velike probleme u poslovanju i u konačnici dovesti do loših rezultata.

Prema Higgsu i Dulewiczu, 2002., učinkovito vodstvo (LQ) predočuje zbroj emocionalne inteligencije (EQ), intelektualne inteligencije (IQ) i menadžerskih kompetencija (MQ).

LQ = EQ + IQ + MQ

Drugim riječima, učinkovito vodstvo zahtijeva dobro razvijenu emocionalnu inteligenciju, a učinkoviti vođe radije se koriste emocionalnom inteligencijom nego formalnim autoritetom koji dolazi s pozicijom.

Rema Danielu Golemanu, emocionalna je inteligencija sposobnost prepoznavanja i razumijevanja vlastitih emocija, sposobnost upravljanja njima, sposobnost razumijevanja emocija drugih ljudi te utjecanja na emocije i ponašanje drugih ljudi.Sukladno New Code Leadership metodologijiTM, emocionalnu inteligenciju čine četiri komponente.

    a) Svijest o sebi – visoka svijest o sebi znači da je vaša slika sebe slična onoj kako vas opisuju ljudi koji vas dobro poznaju i koji imaju mogućnost procjene. Ona pretpostavlja svijest o vlastitim snagama i slabostima, kao i kreiranje jasne vizije života kakav želite živjeti. Ako nemate viziju vlastita života, ne znate što vam je važno da biste bili zadovoljni i ispunjeni, završit ćete život ispunjavajući nečiju tuđu viziju, što može rezultirati snažnim osjećajem nezadovoljstva.
    b) Upravljanje sobom – pretpostavlja upravljanje vlastitim emocijama, motivacijom i ponašanjem. Ako uspješno upravljate emocijema, lakše ćete se motivirati za poduzimanje akcija koje su vam bitne za ostvarenje ciljeva. Također, ovamo ulazi upravljanje vremenom, prioritetima, uspješno donošenje odluka i rješavanje problema.
    c) Svijest o drugima – odnosi se na empatiju prema drugima, razumijevanje drugih i svijest o zajednici koja vas okružuje, ali i shvaćanje kako velike rezultate možete postići samo u suradnji s drugima. Mi smo prije svega bića zajednice.

Svaka kompanija i svaki tim također čini zajednicu. Timske ciljeve i rezultate ne možete postići sami. Za to vam je potrebna suradnja s drugima koja se temelji na poštovanju i empatiji. Vodite li tim, članovi su tima zaduženi svaki za svoj dio posla. Trebate prepoznati tko je dobar za koji posao i kako svakom članu tima dodijeliti ulogu u kojoj će ostvariti najveći doprinos. To možete samo ako prepoznajete različite tipove osobnosti i motivacijske programe svakog člana tima.

    d) Upravljanje odnosima, menadžerske vještine i vještine vođenja timova – upravljanje odnosima uključuje kreiranje i zadržavanje dugoročno kvalitetnih odnosa s drugima kroz jasnu i konstruktivnu komunikaciju i prezentaciju, vještine utjecanja, pregovaranja, rješavanja konflikata te mogućnost suradnje s drugim ljudima u timu ili grupi. Ako ste na poziciji vođe, onda ovamo pripadaju menadžerske vještine i vještine vođenja.

Zaključno, visoka razina emocionalne inteligencije pretpostavlja poznavanje sebe, svojih vrijednosti, život i rad u skladu s njima, upravljanje svojim emocijama i ponašanjem, općenito zauzimanje pozitivnog stava, svijest o ljudima koji nas okružuju, razumijevanje njihovih stajališta i razmišljanja, razvijenu empatiju prema drugima te rad i djelovanje za dobrobit drugih.

Lider visoke emocionalne inteligencije dobar je komunikator i pregovarač, ima moć utjecaja te je kadar zajedno s drugima raditi na ostvarenju svojih, timskih i organizacijskih ciljeva.

Dobra je vijest kako na kvocijent inteligencije nemate previše mogućnosti utjecaja, dok emocionalnu inteligenciju možete razvijati. Usto, ako radite na sebi, emocionalna inteligencija raste s iskustvom i godinama. Naime, što više ljudi upoznate, što više poslovnih situacija iskusite, lakše ćete prepoznati različite tipove ljudi, znati prilagoditi komunikaciju i uspješnije ih voditi.","kako-voditi-sebe-i-druge-naslov-210313","Mirta Faisman-Čobanov"
"Prodajni mindset","2.965 rsd","https://www.korisnaknjiga.com/photo/books0211/p210307b0.jpg","Knjige o biznisu","Odlomak:

Ponašate li se kao vrhunski prodavač?

I odmah u glavu s potpitanjem, što je to što razlikuje vrhunskog prodavača od prosječnog i što prodavači trebaju napraviti ako žele biti uspješni? Ovime ulazimo u dubinu prodaje, odnosno pokušat ću objasniti kako doći do toga da vas se smatra vrhunskim.

Cilj je svakog prodavača, ili bi barem trebao biti, implementacija osobnog prodajnog brenda u svakodnevni, zahtjevni i stresni poslovni život, a to je nit vodilja za kreiranje uspješne i održive karijere u profesionalnoj prodaji. Jednostavnim rječnikom, kupac kupuje radi mene!

E sad, kreiranje osobnog prodajnog brenda proizlazi iz svih oblika profesionalne, organizirane komunikacije pojedinca u svim područjima društva. Glavni je cilj uspješno pozicionirati pojedinca, a kroz to i kompaniju za koju radi u percepciji okoline. Kapitalizam modernog doba, okružen negativnim ispadima globalizacije, treba fleksibilne (da, zato je fleksibilnost bila zadnja u prijašnjem poglavlju) ljude koji moraju stalno promicati, afirmirati i pozicionirati sebe iznova. Današnje je poslovno okruženje brutalno, a prodavač ga treba kontrolirati kako bi bio uspješan. Kontroliranje poslovnog okruženja ne funkcionira na tuđem, već na svom terenu te mu omogućuje nadzor nad vremenom i prostorom u kojem djeluje.

U nastavku želim podijeliti s vama popis aktivnosti koje vrhunski prodavači rade iz dana u dan, odnosno, ono što ih izdvaja iz mase, da ne kažem prosjeka. U ovom poglavlju možete provjeriti koliko zapravo tih stvari radite, preispitati sebe i biti sigurni gdje se na putu do vrhunskog prodavača nalazite.

Vrhunski prodavači postavljaju ciljeve

I odmah opet pitanja za vašu samoanalizu… Koliko ste si ciljeva postavili u posljednjih pet godina? Koliko ste ih izmjerili? Ako ste kao većina prodavača, imate velike ciljeve koje mjerite, a možda imate i neke druge ciljeve koje mjerite, ali budimo iskreni – veliku većinu ne mjerite. Zašto?

Ne mjere se jer ne želimo uistinu imati dokaz da ne uspijevamo. Oni najbolji ne promatraju ciljeve na taj način. Oni na sve ciljeve gledaju kao na stvari koje valja mjeriti. Za njih je ključno što će im mjerenje ciljeva pomoći da nauče. Da, oni žele pobijediti i žele postići svaki cilj koji si postave, ali isto tako znaju da je njihovo postizanje samo dio postupka. Kako bi bili vrhunski, vide svaki cilj ne samo kao nešto što valja postići, nego i nešto iz čega valja učiti. Vrhunski prodavači koriste ciljeve kao referentne točke u svom radu. Mala vježba za vas koji ovo čitate – pogledajte svoje prodajne ciljeve. Što iz njih možete naučiti?

Što biste mogli podesiti ili modificirati kako bi vam pomoglo ne samo da bolje postignete cilj, nego da to primijenite i na druge aktivnosti.

Ugradite u svoj kontinuirani proces učenja da ciljeve koristite kao sredstvo za poboljšanje onoga što radite. Svrha je da možete uzeti svaki cilj i iz njega naučiti nešto novo što onda možete primijeniti na nešto drugo.

Primjer cilja je da otvorite barem pet novih kupaca svake godine. Kako prolazite procesom otvaranja pet novih kupaca, koje stvari možete naučiti kako bi vam pomogle povećati biznis koji ostvarujete sa sadašnjim kupcima? Što više možete ostvariti sa svakom stvari koju radite, više ćete moći primijeniti na ostalo. Na kraju će vaši ukupni rezultati iz svih vaših ciljeva biti bolji.

Vrhunski prodavači nisu zadovoljni prosjekom

Oni stalno nastoje ne samo ostvariti, nego i pregaziti taj broj. Na kraju godine ne zatvaraju posao samo zato jer je broj ostvaren. Oni nastavljaju dalje! Posljednje je tromjesečje u godini i znate da ćete ostvariti broj. S tim saznanjem počinjete pomicati fokus na sljedeću godinu i uređivati stvari kako biste godinu započeli brzim startom.

Da, vrhunski prodavači rade upravo to, ali se također ne igraju sa svojim brojevima na kraju godine kako bi sljedeća godina počela brzim startom. Ako je posao tamo, oni ga grabe i grabe ga odmah. Bez otezanja. Bez igara. Ništa neće više frustrirati menadžera prodaje ili višeg menadžera nego prodavači koji sebe vide kao jedinu osobu koju treba zadovoljiti. Za svaku osobu koja je možda ostvarila broj, lako je moguće da postoji netko tko nije uspio postići brojke. Ako oni koji imaju sposobnost da prijeđu broj odluče ne prijeći broj, onda je čitav tim u opasnosti da neće postići brojke. Oni najbolji to shvaćaju. Oni znaju da se ne radi o njima. Znaju da su dio tima i, što je važnije, znaju koju ulogu igraju u pružanju usluge svojim kupcima. To ne znači samo preuzimanje narudžbi, nego i izlaženje i uzimanje narudžbi bez obzira kakav će to utjecaj imati na njihove individualne brojeve, bilo kratkoročno ili dugoročno. Oni ciljeve ne promatraju kao krajnji broj. Za njih je cilj kontrolna točka pored koje moraju proći dalje. Ponose se brzinom kojom mogu postići cilj. Za njih cilj nije stvaranje cilja, nego vrijeme koje je potrebno za stvoriti cilj.

Vrhunski prodavači znaju da je njihov posao pomoći onima oko njih

Prosječni se prodavač bavi samo svojim vlastitim uspjehom. Međutim, vrhunskom prodavaču pobjeda znači nešto samo ako i drugi dobivaju.

Nazivam ih vrhunskima zbog načina na koji pomažu/komuniciraju s drugima. Oni promatraju kupce s poštovanjem i koriste svaku priliku kako bi im pomogli uspjeti. Isto vrijedi i za to kako VRHUNSKI prodavači pomažu onima s kojima rade, bilo da se radi o članovima njihovog prodajnog tima ili drugim ljudima u njihovoj kompaniji.

Malo nogometnog žargona – nogometaš Luka Modrić to najbolje zna. Zna da je uspješan. Zna da je jedan od najboljih u igranju ove igre, ali isto tako zna koje uloge imaju svi drugi igrači u njegovom timu. Najbolji prodavači slijede sličan princip. Ovdje su da pomognu u usmjeravanju, uvježbavanju i opremanju drugih. Znaju da postoji vrijeme kada moraju gledati izvan svoje to-do liste kako bi pomogli nekome drugome.

Vrhunski prodavači to razumiju jer znaju kako se stvari brzo i u bilo koje doba mogu promijeniti, tako da onda oni mogu biti ti koji traže pomoć. Postoji nešto vrlo zanimljivo u pomaganju drugima kako bi pobijedili. U prvom redu, to mijenja vaše mentalno stanje. Kada si uzmete vremena da pomognete drugima, odjednom postanete jače fiksirani na vlastiti rad i pronalaženje čak i više načina da pomognete drugima.

Drugo, to mijenja vaš način razmišljanja. Kad pomognete jednoj osobi, veća je vjerojatnost da ćete pomoći i drugoj osobi. Odjednom, dešava se da vrhunski prodavač ne pomaže samo svojoj organizaciji, već i kupčevoj organizaciji. Pomaganje kupcima pomaže izgradnji boljeg biznisa. Vrhunski se prodavači vide kao dio tima.","prodajni-mindset-naslov-210307","Vedran Sorić"
