title,price,thumbnail,category,description,url,author
"Evro - kako zajednička valuta ugrožava","2.750 rsd","https://www.korisnaknjiga.com/photo/books0098/p097172b0.jpg","Knjige o biznisu","Džozef Stiglic pokušava da anlizira učinke evropske valute i da da rešenje za izazak iz loše situacije u kojoj se Evropa našla.
Autor analizira neke od najtežih problema poput ekonomske stagnacije, pogrešne strategije Evropske centralne banke, kriminalne politike Trojke prema državama koje su najviše stradale u krizi i dr.
U knjizi možete pročitati i pogovor o rezultatima i značaju britanskog referenduma o napuštanju Evropske unije.","evro-kako-zajednicka-valuta-ugrozava-naslov-97172","Džozef E. Stiglic"
"2012+","3.455 rsd","https://www.korisnaknjiga.com/photo/books0097/p096900c0.jpg","Knjige o biznisu","U knjizi Jadranka Prlića možete pročitati sve o aktuelnim ekonomskim dešavanjima i shvatiti da pojam globalnog postaje preduslov za funkcionisanje društvenog života. Autor to posmatra kao napredak u pogledu većeg zapošljavanja.","2012+-naslov-96900","Jadranko Prlić"
"Plava ekonomija","4.474 rsd","https://www.korisnaknjiga.com/photo/books0097/p096375c0.jpg","Knjige o biznisu","Danas se susrećemo sa velikim uništavanjem prirode od strane čoveka zarad profita. Ginter Pauli objašnjava da se određenim tehnološkim i hemijskim napretkom može učiniti manje štete prirodi, a više dobrobiti čoveku.
Uz određene inovacije i promene, plava ekonomija pokazuje da je moguće spojiti profit sa težnjom ka očuvanju planete i njenog ekosistema.","plava-ekonomija-naslov-96375","Gunter Pauli"
"Uvod u ekonomiju","1.230 rsd","https://www.korisnaknjiga.com/photo/books0097/p096236b0.jpg","Knjige o biznisu","Uvod u ekonomiju je udžbenik namenjen studentima Mašinskog fakulteta, katedra za industrijsko inženjerstvo.
Osnovi ekonomije, škole ekonomske misli, osnovi proizvodnje i troškova, tržište, tražnja i ponuda, preduzeće kao osnovni organizacioni oblik profitne organizacije, tžište i novac, ekonomski rast i razvoj, globalizacija i ""nova ekonomija"".","uvod-u-ekonomiju-naslov-96236","Slobodan Pokrajac, Nikola Dondur"
"Metodologija ekonomskih istraživanja i dizajniranje radova na akademskim studijama","1.650 rsd","https://www.korisnaknjiga.com/photo/books0087/p086448c0.jpg","Knjige o biznisu","Metodologija ekonomskih istraživanja i dizajniranje radova na akademskim studijama je udžbenik koji mogu koristiti studenti, ali i nastavnici, naučnici, menadžeri i svi ostali koji se bave ovom oblašću i koji pišu naučne radove. Knjiga nudi dosta praktičnog znanja u području ekonomskih nauka. Pomoći će svakom studentu, nastavniku ili bilo kom drugom stručnjaku da kreira i napiše rad. Knjiga je napisana razumljivo, jasno, postupno i pristupačna je svima.","metodologija-ekonomskih-istrazivanja-i-dizajniranje-radova-na-akademskim-studijama-naslov-86448","Vidoje Vujić, Radovan Pejanović"
"Upravljanje krizom - svet i mi","3.000 rsd","https://www.korisnaknjiga.com/photo/books0086/p085784c0.jpg","Knjige o biznisu","Upravljanje krizom - svet i mi je knjiga o aktuelnoj ekonomskoj problematici, svestkoj ekonomskoj krizi i njenom uticaju na privredu u Srbiji. Autor iznosi podatke o nastanku i delovanju ekonomske krize, kako se ona širi i deluje i kakve posledice ima po našu privredu.","upravljanje-krizom-svet-i-mi-naslov-85784","Prof. dr Jovan Gorčić"
"Javno privatno partnerstvo i mogućnost njegove primene u saobraćaju i putnoj privredi RS","2.400 rsd","https://www.korisnaknjiga.com/photo/books0086/p085783b0.jpg","Knjige o biznisu","Peta knjiga iz edicije Fiskalne reforme i modernizacija upravljanja javnim sektorom RS koja se odnosi na javno partnerstvo.
Autor govori o partnerstvu javnog i privatnog sektora, o pravnom okviru za JPP, o javno-privatnom partnerstvu u transportu i putnoj privredi, o potrebama i mogućnostima primene JPP u putnoj privredi RS, kao i o primerima dobre prakse JPP.","javno-privatno-partnerstvo-i-mogucnost-njegove-primene-u-saobracaju-i-putnoj-privredi-rs-naslov-85783","Prof. dr Jovan Gorčić"
"Fiskalna autonomija i finansiranje razvoja regionalne i lokalne samouprave i stavovi EU","2.400 rsd","https://www.korisnaknjiga.com/photo/books0086/p085781c0.jpg","Knjige o biznisu","Treća knjiga iz edicije Fiskalne reforme i modernizacija upravljanja javnim sektorom RS. Knjiga se nastavlja na drugu knjigu iz ove edicije i govori o probelmima decentralizacije kroz regionalni razvoj. U knjizi piše šta je sve potrebno Srbija da uradi i promeni da bi unapredila demokratiju i tržišnu privredu.","fiskalna-autonomija-i-finansiranje-razvoja-regionalne-i-lokalne-samouprave-i-stavovi-eu-naslov-85781","Prof. dr Jovan Gorčić"
"Fiskalni federalizam, lokalna samouprava i budžetske politike","1.800 rsd","https://www.korisnaknjiga.com/photo/books0086/p085780b0.jpg","Knjige o biznisu","Knjiga iz edicije Fiskalne reforme i modernizacija upravljanja javnim sektorom RS.
Prvi deo knjige odnosi se na teoriju fiskalnog federalizma i lokalne samouprave, a drugi deo prati savremeni budžetski sistemi budžetske politike.","fiskalni-federalizam-lokalna-samouprava-i-budzetske-politike-naslov-85780","Prof. dr Jovan Gorčić"
"Socijalna ekonomija: pojam i praksa u Srbiji","880 rsd","https://www.korisnaknjiga.com/photo/books0085/p084680c0.jpg","Knjige o biznisu","Knjiga Socijalna ekonomija: pojam i praksa u Srbiji nastala je kao rezultat višegodišnjeg autorevog proučavanja oblasti socijalne ekonomije i preduzetništva u Srbiji. Takođe, preispitivao je odnos društvene nauke i primenjene politike i položaj društvenog naučnika u savremenom svetu. Autor smatra da naučnik treba da radi na razvijanju i popravljanju društva.","socijalna-ekonomija-pojam-i-praksa-u-srbiji-naslov-84680","Slobodan Cvejić"
"Kriza u evrozoni: najskuplji razvod na svetu","1.980 rsd","https://www.korisnaknjiga.com/photo/books0084/p083081c0.jpg","Knjige o biznisu","Kriza u evrozoni: najskuplji razvod na svetu jeste knjiga kojaje nastala kao rezultat analize krize u evrozoni i obrade empirijske  građe koju je autor posedovao. Radonjić pokazuje perspektivu i pravac kojim treba krenuti kako bi se obezbedio opstanak Evropske monetarne unije. 
U knjizi se razmatra stav da koreni krize leže u razlikama severnjačke  i mediteranske (naročito grčke) kulture, etike i duha naroda. Autor dovodi u pitanje taj stav i smatra da bi pre trebalo ovakav ekonomski problem da se sagleda samo iz ugla ekonomske nauke.","kriza-u-evrozoni-najskuplji-razvod-na-svetu-naslov-83081","Ognjen Radonjić"
"Demistifikacija kineske ekonomije","990 rsd","https://www.korisnaknjiga.com/photo/books0083/p082568c0.jpg","Knjige o biznisu","Nekada je Kina predstavljala razvijenu i vodeću zemlju u svetu ekonomije, ali to njeno vođstvo naglo opalo pa je od kraja 19. veka ona postala jedna od najsiromašnijih zemalja. Ponovni preokret se dogodio tek uvođenjem tržišnog modela privređivanja 1978. godine. Od tada Kina je jedna od vodećih zemalja sa najdinamičnijom ekonomijom.
Autor nam u knjizi Demistifikacija kineske ekonomije objašnjava zašto Kina u jednom periodu bila ekonomski osiromašena i kako se ponovo razvila i napredovala.","demistifikacija-kineske-ekonomije-naslov-82568","Džastin Jifu Lin"
"Kada novca ponestane","7.385 rsd","https://www.korisnaknjiga.com/photo/books0078/p077928b0.jpg","Knjige o biznisu","Knjiga Kada novca ponestane treba da se nađe u obaveznoj literaturi svima onima koji se bave savremenom ekonomijom. 

Dok se političari i ekonomisti prepiru oko toga na koji način treba pokrenuti ekonomski rast, Stephen D. King tvrdi da nema laganih rešenja za teškoće Zapada, i da više sebi ne možemo priuštiti ispunjenje svega onoga što smo nekada obećali. 
Knjiga je napisana jasnim  i živahnim stilom, stalno se poziva na prošlost kako bi pronašlo uzroke, posledice i izglednu katastrofu.","kada-novca-ponestane-naslov-77928","Stephen D. King"
"Usluge od opšteg ekonomskog interesa u Evropskoj uniji","880 rsd","https://www.korisnaknjiga.com/photo/nobookb.jpg","Knjige o biznisu","","usluge-od-opsteg-ekonomskog-interesa-u-evropskoj-uniji-naslov-75962","Daliborka Petrović"
"Velika podela","2.420 rsd","https://www.korisnaknjiga.com/photo/books0075/p074564b0.jpg","Knjige o biznisu","Podnaslov dela glasi: Društva nejednakosti i šta da radimo sa njima.

Između ljudi postoje sve veće ekonomske razlike među ljudima: kako prema imovini, tako i prema dohotku. Velika podela je metafora koja predstavlja te razlike. U knjizi koja je pred vama, one su veoma uver­ljivo prikazane pre svega na primeru SAD, ali su navedene i kao loša globalna tendencija koja traje tokom poslednje četiri decenije. 

Eska­lacija nejednakosti do ekstrema, delimično je uzrok sporog ekonomskog rasta, ali su spori rast i nejednakost „pitanja političkog izbora”. Oni reprodukuju stanje začaranog kruga u kome su institucije, zakoni, sistem oporezivanja, pa i izbori, podređeni interesima gornjih 1% stanovništva. Taj 1% koji u SAD raspolaže sa blizu 22% bogatstva (a najbogatijih 0,1% sa oko 11%) uspeva da zahvaljujući koncentraciji moći dalje povećava nejednakost i nepremostivi jaz, pa čak i fizičko razdvajanje bogatih če­tvrti u odnosu na siromašne delove gradova, a sa obrazloženjem zaštite održavanja javnih dobara, ili pak omogućavanja povoljnog socijalnog i kulturnog okruženja za razvoj njihove dece.","velika-podela-naslov-74564","Džozef E. Stiglic"
"Savremena kineska ekonomija","880 rsd","https://www.korisnaknjiga.com/photo/nobookb.jpg","Knjige o biznisu","Savremena kineska ekonomija / Li Vu, Venli Žung ; s engleskog prevela Tijana Jović.","savremena-kineska-ekonomija-naslov-73124","Li Vu, Venli Žung"
"Modernizacija kineske ekonomije","770 rsd","https://www.korisnaknjiga.com/photo/books0074/p073122c0.jpg","Knjige o biznisu","Knjiga koja će vam objasniti ""kinesko čudo"", odnosno kako su institucionalne promene u kineskoj ekonomiji dovele do takvog progresa. Pročitajte o tome kako je efikasno preuzimanje „hongkonškog modela“ privređivanja otvorilo je perspektive njene svetske konkurentnosti.  

Posredujući istorijska i inostrana iskustva u reformi vlasništva državnih kompanija, vlada je svojim merama povlačenja akcionarskog kapitala iz pomenutih preduzeća otvorila put dinamičnijem privatnom preduzetništvu, sa znatno efikasnijim upravljačkim menadžmentom, a samim tim stvorila neophodne pretpostavke za vodeću ulogu Kine u svetskoj ekonomiji...","modernizacija-kineske-ekonomije-naslov-73122","Sjao Geng"
"Razgovori s velikim ekonomistima","3.938 rsd","https://www.korisnaknjiga.com/photo/books0073/p072528b0.jpg","Knjige o biznisu","Niz dijaloga sa grupom međunarodno renomiranih ekonomista vođenih s namerom pojašnjavanja savremene ekonomske teorije, njenog trenutnog stanja i razvoja.","razgovori-s-velikim-ekonomistima-naslov-72528","Diego Pizano"
"Sveti gral makroekonomike","7.385 rsd","https://www.korisnaknjiga.com/photo/books0073/p072527c0.jpg","Knjige o biznisu","Pouke iz velike recesije Japana.","sveti-gral-makroekonomike-naslov-72527","Richard Koo"
"Kad novca ponestane","3.570 rsd","https://www.korisnaknjiga.com/photo/books0073/p072526b0.jpg","Knjige o biznisu","Kraj imućnog zapada. Odabrana za najbolju knjigu 2013. godine prema izboru ekonomista.","kad-novca-ponestane-naslov-72526","Stiven D. King"
"Interna revizija - podrška procesu upravljanja","2.200 rsd","https://www.korisnaknjiga.com/photo/books0062/p061082b0.jpg","Knjige o biznisu","Knjiga Interna revizija − podrška procesu upravljanja bavi se internom revizijom kao jednom od bitnih pretpostavki kvalitetnog internog nadzora i procesa upravljanja uopšte, sa posebnim naglaskom na teorijske i metodološke aspekte procesa interne revizije. Knjiga je koncipirana tako da naglašava značaj koji funkcija interne revizije ima u procesu upravljanja savremenom organizacijom kao i one oblasti u kojima može pružiti najveći doprinos. Prema svojoj definiciji, interna revizija predstavlja savetodavnu i ocenjivačku funkciju čiji je zadatak da pomogne menadžmentu u unapređenju internih kontrola, upravljanja rizicima i celokupnog procesa upravljanja. Na ovako definisanim polaznim osnovama zasnovana je celokupna struktura rada.","interna-revizija-podrska-procesu-upravljanja-naslov-61082","Tamara Stojanović"
"Konkurentnost privrede","1.430 rsd","https://www.korisnaknjiga.com/photo/books0058/p057019c0.jpg","Knjige o biznisu","Knjiga profesora Unkovića na razložan način se bavi redefinisanjem nacionalne privredne strategije. Njegova definicija konkurentnosti je najkraća moguća i skoro savršena u svojoj jednostavnosti - konkurentnost je superiornost u odnosu na rivale.

Unković razmišlja integrativno - da li smo naučili lekcije? Znamo li zašto su neke zemlje bolje od drugih, te eksplicitno postavlja pitanje kritički analizirajući lošu poziciju Srbije na svetskim listama konkurentnosti. Nova faza razvoja iziskuje nove investicione politike zasnovane na regionalnom povezivanju.

„Ukoliko radikalno ne promenimo naš način rada i ne prestanemo da primenjujemo metode koje su bile efikasne u industrijskoj ekonomiji, a sad to više nisu – mi se nećemo održati u postojećem poslovnom okruženju koje se radikalno menja”, zaključuje autor sa veoma bogatim iskustvom državnika, univerzitetskog profesora i operativnog rukovođenja kompanijama i lokalnom samoupravom.","konkurentnost-privrede-naslov-57019","Milorad Unković"
"Kapital u XXI veku","4.015 rsd","https://www.korisnaknjiga.com/photo/books0057/p056265b0.jpg","Knjige o biznisu","Iz recenzije:

’’Knjiga Tome Piketija ’’Kapital u XXI veku’’ nije slučajno postala svetski bestseler. To je knjiga koja se bavi trenutno najakutnijim problemom svetskog kapitalizma: nejednakošću. Piketi, koji je već napisao ključne radove u ovoj oblasti, koristi obimni statistički materijal iz najrazvijenih zemalja da pokaže da je rast nejednakosti, ukoliko se ne preseče političkim akcijama kao što su viši porezi, imanentan kapitalizmu, naročito u periodu njegovog sporog rasta. Knjiga se obraća svakom obrazovanom čitaocu, ne neophodno ekonomisti, i čita se skoro kao istorijski roman.’’

Branko Milanović","kapital-u-xxi-veku-naslov-56265","Toma Piketi"
"Ekonomija postmoderne","550 rsd","https://www.korisnaknjiga.com/photo/books0054/p053490c0.jpg","Knjige o biznisu","","ekonomija-postmoderne-naslov-53490","Jovan B. Dušanić"
"Politike izgradnje velikih trgovina u Srbiji","660 rsd","https://www.korisnaknjiga.com/photo/books0054/p053487c0.jpg","Knjige o biznisu","","politike-izgradnje-velikih-trgovina-u-srbiji-naslov-53487","Milica Maksić"
"Ekonomska elita u Srbiji u periodu konsolidacije kapitalističkog poretka","2.200 rsd","https://www.korisnaknjiga.com/photo/books0053/p052872c0.jpg","Knjige o biznisu","Osnovni cilj rada je da se ispita dinamika promena vrednosnih orijentacija političkog i ekonomskog liberalizma pripadnika ekonomske elite Srbije u periodu postsocijalističke transformacije. Drugi cilj je da se utvrde specifični činioci koji određuju potencijalne linije diferenciranja analizirane grupacije u pogledu stepena pristajanja uz date vrednosti u periodu krize neoliberalnog oblika kapitalističke regulacije. Teorijsko-hipotetički okvir analize izveden je iz teorije vrednosno-normativne disonance, dok je metodološki plan pretpostavljao poređenje empirijskih podataka dobijenih u tri vremenske tačke – pred slom socijalističkog sistema (1989), u periodu učvršćivanja kapitalističkih odnosa (2003) i u momentu kada neoliberalni oblik kapitalističke regulacije doživljava krizu na globalnom i lokalnom nivou (2012). Komparativni okvir analize pretpostavljao je značajna ograničenja koja su vodila redukciji raspoloživih dimenzija proučavanih vrednosnih orijentacija i korišćenje relativno jednostavnih metoda deskriptivne analize. Ispitivanje činilaca političkog i ekonomskog liberalizma u 2012. godini omogućilo je korišćenje nešto pouzdanijih indikatora i sofisticiranijih tehnika statističke obrade podataka.","ekonomska-elita-u-srbiji-u-periodu-konsolidacije-kapitalistickog-poretka-naslov-52872","Milan Lazić"
"Međunarodne finansijske institucije","330 rsd","https://www.korisnaknjiga.com/photo/books0052/p051854c0.jpg","Knjige o biznisu","Međunarodne finansijske institucije.","medjunarodne-finansijske-institucije-naslov-51854","Dejan Jovović"
"Jugoslavija u međunarodnim finansijama I","400 rsd","https://www.korisnaknjiga.com/photo/nobookb.jpg","Knjige o biznisu","Jugoslavija u međunarodnim finansijama I.","jugoslavija-u-medjunarodnim-finansijama-i-naslov-51844","Urednik Blagoje Babić"
"Jugoslavija u međunarodnim finansijama II","400 rsd","https://www.korisnaknjiga.com/photo/nobookb.jpg","Knjige o biznisu","Zbornik radova - Jugoslavija u međunarodnim finansijama II.","jugoslavija-u-medjunarodnim-finansijama-ii-naslov-51839","Blagoje Babić"
"Svetska privreda u informatičkoj eri","440 rsd","https://www.korisnaknjiga.com/photo/books0052/p051595c0.jpg","Knjige o biznisu","Svetska privreda u informatičkoj eri.","svetska-privreda-u-informatickoj-eri-naslov-51595","Grupa autora"
"Sanacija bankarskih sistema","440 rsd","https://www.korisnaknjiga.com/photo/books0052/p051594c0.jpg","Knjige o biznisu","Sanacija bankarskih sistema.","sanacija-bankarskih-sistema-naslov-51594","Pero Petrović"
"Centralnoevropska zona slobodne trgovine i interesi Srbije (CEFTA)","605 rsd","https://www.korisnaknjiga.com/photo/books0052/p051579c0.jpg","Knjige o biznisu","Zbornik radova - Centralnoevropska zona slobodne trgovine i interesi Srbije (CEFTA).","centralnoevropska-zona-slobodne-trgovine-i-interesi-srbije-(cefta)-naslov-51579","Urednica Edita Stojić-Karanović"
"Ekonomska bezbednost poslovanja","1.540 rsd","https://www.korisnaknjiga.com/photo/books0052/p051535c0.jpg","Knjige o biznisu","Ekonomska bezbednost poslovanja.","ekonomska-bezbednost-poslovanja-naslov-51535","Milan Stojanović i Dejan Pavlović"
"Unapređenje turizma kao faktor razvoja privrede Srbije","1.210 rsd","https://www.korisnaknjiga.com/photo/books0052/p051514c0.jpg","Knjige o biznisu","Tematski zbornik radova.","unapredjenje-turizma-kao-faktor-razvoja-privrede-srbije-naslov-51514","Urednici Pero Petrović i Vidoje Golubović"
"Savremena međunarodna trgovina","880 rsd","https://www.korisnaknjiga.com/photo/books0052/p051462c0.jpg","Knjige o biznisu","Savremena međunarodna trgovina.","savremena-medjunarodna-trgovina-naslov-51462","S.Jelisavac, I.Popović, P.Bjelić"
"Ekonomija krize","825 rsd","https://www.korisnaknjiga.com/photo/books0051/p050780c0.jpg","Knjige o biznisu","Razbijanje ekonomskih mitova.

Knjiga o aktuelnoj ekonomskoj krizi i o krizi ekonomskih mitova.

Govoreći o uzrocima i posledicama ekonomske krize, Nikolić raspravlja o rebalansu globalne ekonomske moći, o tome kako nastaju i zašto se održavaju ekononski mitovi, o posledicama nejednakosti, o godinama koje je pojela kriza i o tome kako će živeti naša deca.","ekonomija-krize-naslov-50780","Goran Nikolić"
"2052: Globalna prognoza za slijedećih 40 godina","7.410 rsd","https://www.korisnaknjiga.com/photo/books0050/p049656b0.jpg","Knjige o biznisu","Znamo ono što želimo znati o tome kako će svet izgledati kroz četrdeset godina. Međutim, znamo li kako će svet zaista izgledati za četrdeset godina? Upravo je to pitanje na koje Jorgen Randers pokušao da odgovori u knjizi 2052.
Pre četrdeset godina, Randers je bio jedan od koautora knjige Granice rasta (The Limits to Growth), studije koja se bavila velikim pitanjem kako će ljudi svoj poriv za neograničenim rastom prilagoditi fizičkim ograničenima planete Zemlje.
U knjizi 2052, Randers polazi od sopstvenog iskustva iz oblasti održivosti, globalnih prognostičkih alata i predviđanja – opisanih u knjizi – više od trideset vodećih naučnika, ekonomista, futurista i drugih mislilaca, koji bi nas trebalo voditi kroz najizgledniju budućnost.","2052-globalna-prognoza-za-slijedecih-40-godina-naslov-49656","Jorgen Randers"
"Kontrarevolucija ekonomije","1.356 rsd","https://www.korisnaknjiga.com/photo/books0050/p049004c0.jpg","Knjige o biznisu","Saša Vujičić u knjizi Kontrarevolucija ekonomije na 450 strana nadahnuto vodi čitaoca kroz istoriju ekonomije i moderne ekonomske procese. On govori o preduzimaštvu i potrebi pojedinca da ide napred, o marksistima, liberalima i svim drugim važnim i nevažnim akterima politike i ekonomije. Knjiga za svakoga ko želi da shvati savremena ekonomska kretanja, kako za ekomiste iz struke, tako i za laike.
“…U svakom ekonomskom sistemu individue igraju veoma važnu ulogu. Sloboda izbora je veoma važna za cjeli ekonomski sistem. Uslov je samo da postoji mogućnost izbora. Zato pojedinac treba da stvara šanse. To je onda u skladu s prirodom. Ali, pojedinci su veoma različiti. Različitost je šansa za pojedince koji imaju bolje poslovne ideje, spremni su na rizik da preuzmu posljedice sopstvene ideje i akcije. Ideja traži akciju. Ako se ne sprovede ona ostaje samo san….”","kontrarevolucija-ekonomije-naslov-49004","Saša Vujičić"
"Operativni rizici u bankama","660 rsd","https://www.korisnaknjiga.com/photo/nobookb.jpg","Knjige o biznisu","Prikazana je nužnost modifikacije sadašnje normativne definicije operativnih rizika. Prema stavu autorke,postojeću definiciju treba proširiti time što će se dodati tzv. moralni hazard i suziti time što će se izuzetiIT rizici. U radu je dokazano da grupa operativnih rizika može da bude autonomni ili dopunski uzročnik bankarskekrize – operativni rizik i finansijska kriza imaju isti koren: moralni hazard. Nizom analiza iz relevantnihstudija i testiranjem sopstvenog rešenja autorka dokazuje da veštačke neuralne mreže pokazuju bolje rezultate odlinearnih statističkih modela.
Summary: Operational risks in banking.","operativni-rizici-u-bankama-naslov-48273","Ana Savić"
"Kreditne rejting agencije na finansijskom tržištu","1.078 rsd","https://www.korisnaknjiga.com/photo/books0048/p047812c0.jpg","Knjige o biznisu","Kreditne rejting agencije dodeljuju rejting ocene entitetima sa ciljem da učesnike na finansijskom tržištu, investitore i korisnike sredstava, informišu o potencijalnim rizicima i mogućnostima. Razvojem finansijskih tržišta i instrumenata one su dobijale sve veći značaj za stabilnost razvoja finansijskog tržišta. Istovremeno je rastao broj korisnika njihovih usluga i vrsta njihovih usluga. Ni svetska ekonomska kriza u kojoj je najviše optužbi bilo upućeno njihovom radu, nije nikada u naučno-stručnim polemikama dovela u pitanje njihov opstanak, već su se samo dovodili u pitanje modifikacija njihovog rada, regulisanje i nadzor. 
U knjizi su date sveobuhvatne smernice razvoja rejting sistema s ciljem da se podstaknu dalja istraživanja u oblasti rejting industrije, i da se utiče na stvaranje svesti o njihovoj potrebi i izrada adekvatne državne strategije njihovog razvoja. Svakako, predmetna oblast istraživanja predstavlja samo „korak napred“ u pravcu intenziviranja razvoja kreditnih rejting agencija.","kreditne-rejting-agencije-na-finansijskom-trzistu-naslov-47812","Tatjana R. Mrvić"
"Akcionarstvo i demokratija","1.056 rsd","https://www.korisnaknjiga.com/photo/books0048/p047511c0.jpg","Knjige o biznisu","Vrhunska studija o odnosu političke demokratije i tržišta kapitala. Oblikujući svoju knjigu u susretu sa velikim temama ekonomije, političke i društvene istorije i teorije, Milko Štimac pokazuje zbog čega su akcionarstvo i demokratija sudbinski povezani. Poseban deo knjige predstavlja uzbudljiva studija slučaja privatizacije i akcionarstva u Srbiji u poslednjih dvadeset pet godina. 
Knjiga Akcionarstvo i demokratija pisana je odličnim stilom i vrlo jasno pokazuje poziciju građana u dinamičnoj i nikada dovršenoj istorijskoj vezi akcionarstva i demokratije.","akcionarstvo-i-demokratija-naslov-47511","Milko Štimac"
"Malo je lepo","1.100 rsd","https://www.korisnaknjiga.com/photo/books0047/p046798c0.jpg","Knjige o biznisu","Naslov originala: Small is beautiful / E. F. Schumacher","malo-je-lepo-naslov-46798","E. Fridrih Šumaher"
"Istorija bankarstva u Vojvodini","1.500 rsd","https://www.korisnaknjiga.com/photo/books0047/p046384c0.jpg","Knjige o biznisu","","istorija-bankarstva-u-vojvodini-naslov-46384","Nikola L. Gaćeša i dr."
"Tržišta kapitala","1.930 rsd","https://www.korisnaknjiga.com/photo/books0045/p044943c0.jpg","Knjige o biznisu","Budući da ga je posebno zanimao način funkcionisanja finansijskih tržišta i uloga tržišta kapitala, autor je odlučio da pred čitaoce iznese svoja istraživanja najvećih i najznačajnijih promena na svetskim tržištima kapitala, koje su se odvijale zadnjih dvadesetak godina. Ujedno, autor nam donosi opširan izveštaj o delovanju najvećih tržišta deonica, obveznica, derivata, institucionalnih investitora i regulacije tržišta. 

Kratak sadržaj:
Uloga i funkcija tržišta trajnog kapitala
Obveznice i tržišta obveznica
Međunarodna tržišta obveznica
Tržišta novim financijskim instrumentima, izvedenicama
Institucionalni investitori
Reguliranje tržišta
Osnovna pitanja tržišta kapitala","trzista-kapitala-naslov-44943","Bernard J. Foley"
"Uticaj finansijske krize na bankarski sektor Srbije","660 rsd","https://www.korisnaknjiga.com/photo/nobookb.jpg","Knjige o biznisu","","uticaj-finansijske-krize-na-bankarski-sektor-srbije-naslov-44805","Jelena Božović"
"Matematičko-statistički modeli i informaciono-komunikacione tehnologije u funkciji razvo","1.222 rsd","https://www.korisnaknjiga.com/photo/nobookb.jpg","Knjige o biznisu","","matematicko-statisticki-modeli-i-informaciono-komunikacione-tehnologije-u-funkciji-razvo-naslov-44790","Grupa autora"
