title,price,thumbnail,category,description,url,author
"8 godina u najtežem zatvoru Tajlanda","1.190 rsd","https://www.korisnaknjiga.com/photo/books0212/p211575b0.jpg","Biografije, autobiografije, memoari","Odlomak:

Ali, 30.april 2011. godine, 20:13 sati po lokalnom vremenu, u Puketu, kao grom dogodio se trenutak kada sam zeznuo svoj život – ispoveda u ovoj izuzetnoj ispovesti svoje dramatično iskustvo i život koji je proveo iza rešetaka u strašnim i surovim uslovima.

Svako osećanje, brutalnost, bezizlaz, slom, gubitak nade da će ponovo grliti ćerkicu, zagrliti majku, opisani su sa tolikom snagom i sugestivnošću, da je Maksimova sudbinska priča više od folma! Ovo je bio stvarni život. Pakao!

U Bombat Piset Klangu, najtežem zatvoru u Bangkoku, zvali su ga “stranac”. Kao Evropljanin nalazio se na najnižoj lestvici među zatvorenicima. 17 sati dnevno provodio je na nepunom kvadratnom metru betonskog poda, a noću naslanjao glavu na praznu plastičnu flašu.

On opstaje jer čeličnom voljom održava svoje telo u formi. Kako bi sačuvao svoje fizičko zdravlje odlučuje se za duhovni put.

Oko mene je bio pravi horor i shvatio sam da prava sloboda počinje samo u meni. Zvuči čudno, ali zatvor je od mene napravio boljeg čoveka i uvek ću biti zahvalan na tome.","8-godina-u-najtezem-zatvoru-tajlanda-naslov-211575","Maksim Klasanović"
"Čovek koji je pušio Bibliju","1.210 rsd","https://www.korisnaknjiga.com/photo/books0210/p209975b0.jpg","Biografije, autobiografije, memoari","Podnaslov dela glasi: Potresna životna priča nekadašnjeg robijaša.

SADRŽAJ
1.	đavo 9
2.	Beg	27
3.	Šansa 59
4.	Krivica	 95
5.	Spasenje 109
6.	Izmirenje 139
7.	Iskušenje 159
8.	Poverenje 123
9.	Otac 183
Epilog					123
Napomene 			122","covek-koji-je-pusio-bibliju-naslov-209975","Vilhelm Bunc"
"Ja, Pink Panter 3: Povratak","990 rsd","https://www.korisnaknjiga.com/photo/books0206/p205869b0.jpg","Biografije, autobiografije, memoari","Iz recenzije:

’’Na sebi svojstven način, Olivera Ćirković vrlo realistično piše o svim užasima grčkog kazamata i pravosuđa. Čvrsto rešena da pobedi neočekivanu pravnu zavrzlamu koja joj je prepreka na putu ka slobodi, odlučno kreće u borbu protiv zatvorske nepravde i nelogičnosti, ne libeći se da stupi čak i u štrajk glađu samo da dobije ono što joj već pripada, a to je dugoočekivana i zaslužena sloboda.

Nakon izlaska iz zatvora, obeshrabrena i odviknuta od „normalnog“ sveta, Olivera odlučuje da život ponovo stavi na kocku i vrati se svom starom zanatu – kriminalu. Ipak, spletom neočekivanih okolnosti dolazi do zaokreta, koji će je vinuti do neslućenih visina popularnosti, i to zahvaljujući baš onome na šta u životu nije računala, a to je – pisanje knjiga.

Olivera nas po treći put zavodi događajima iz svog života u zatvoru i posle njega, istovremeno nas uvlačeći u jedan svet pun raznoraznih živopisnih likova, gradova i sajmova. Ovom knjigom ona zatvara trilogiju posvećenu svom životu, a nama ostavlja svedočanstvo jedne bivše sportistkinje i prestupnice koje će nas uvek podsećati da ljubav, iskrenost i upornost pobeđuju na našem putu ka uspehu.

Greh nije pasti, greh je pasti a ne ustati, a Oliverin primer snažno potvrđuje tezu da se i oni pali na krajnje dno mogu dići iz pepela i odsanjati svoje snove, i to na potpuno legalan i društveno prihvatljiv način.’’","ja-pink-panter-3-povratak-naslov-205869","Olivera Ćirković"
"Grad: Psihobiografija cara Dušana","1.320 rsd","https://www.korisnaknjiga.com/photo/books0203/p202916b0.jpg","Biografije, autobiografije, memoari","Iz recenzije:

’’Grad, psihobiografija Stefana Uroša IV Dušana Nemanjića, predstavlja neku vrstu podvižništva, upravo napor potrage za Duhom istorije, koji se krije medju tumulusima i apsidama nekropola, medju zapisima na belinama knjiga, povelja i stenopisa. To je neka vrsta nevidljivog, ali nesumnjivo postojećeg paralelnog sveta u kome žive i umiru stvarni ljudi sa svojim porodicama, prijateljima i neprijateljima, sa svojim ljubavima i mržnjama, strahovima, opsesijama, osujećenjima i ostvarenjima, dubokim potištenostima, ushićenjima i egzaltacijama.

...izdajnička strast koju autor nastoji da prikrije, fascinacija likovima i vremenom, i intelektalna intuicija koja se spontano nameće, oplemenju ravnodušnost istoriografije i hladnu aroganciju psihologije, dajući tekstu drugu dimenziju.’’","grad-psihobiografija-cara-dusana-naslov-202916","Aleksandar Misojčić"
"Ovo sam ja","799 rsd","https://www.korisnaknjiga.com/photo/books0200/p199660b0.jpg","Biografije, autobiografije, memoari","Aca Lukas, jedna od najvećih muzičkih zvezda Balkana, u ovoj knjizi, surovo iskreno i bez dlake na jeziku, otkriva sve one šokantne detalje iz svog privatnog i profesionalnog života koji su oduvek pobuđivali radoznalost javnosti. Svoju ispovest pevač započinje boravkom u zatvoru, a nakon toga hronološki iznosi događaje koji su sledili.

Odlomak:

Sve laži o meni su istinite i sve istine o meni su lažne

… Moja karijera je od početka bila ozbiljna stihija u kojoj još uvek dobro plivam i pritom uživam…

… Imao sam lisice na rukama kad sam se u zatvorskom hodniku sreo s Cecom Ražnatović…

… U zatvoru sam shvatio da čovek može da živi bez seksa, ali ne može da živi bez pesme…

… Za jednu saobraćajku sa falš vozačkom dozvolom dobio sam četiri tužbe…

… U hotelu u Negotinu pokušao sam da provedem jednu noć kao Kit Ričards…

… Moja prva supruga Ceca bila mi je drugarica iz detinjstva, Nataša je htela da živim po njenim principima, a Sonja je pokušala da od mene napravi pudlicu…

… Posle dvonedeljnih bahanalija u Parizu otišao sam u Švajcarsku, u specijalnu ustanovu za odvikavanje od droge…

… Uoči koncerta u Međugorju vođa zelenih beretki iz Mostara poručio je da će me ubiti, a posle koncerta smo postali prijatelji…

… Zašto na takmičenjima početnika majke padaju u nesvest, a očevi članovima žirija preporučuju svoje ćerke?…","ovo-sam-ja-naslov-199660","Aca Lukas"
"Život čoveka na Balkanu","1.540 rsd","https://www.korisnaknjiga.com/photo/books0163/p162030b0.jpg","Biografije, autobiografije, memoari","Odlomak:

...Taj život, život jednog čoveka sa Balkana, odigravan u jednom čudnom vrtlogu nacionalnih, verskih, ideoloških, političkih i društvenih sukoba, strasti, međusobnog uništavanja, nemilorodnih sudbina, jezivih tragedija, često usred jedne herojske simfonije podviga i stradanja, želim ovde da evociram...

...Jer to što ja hoću da evociram, to nije samo moj život, to je uglavnom život miliona ljudi sa jednog istog geografskog područja i iz jedne iste istorijske epohe, često nerazumljive i neverovatne za one koji su bili izvan toga prostora i izvan toga vremena...","zivot-coveka-na-balkanu-naslov-162030","Stanislav Krakov"
"Znam zašto ptica u kavezu peva","990 rsd","https://www.korisnaknjiga.com/photo/books0140/p139863b0.jpg","Biografije, autobiografije, memoari","Prva od šest autobiografskih knjiga autorke. Smatra se njenom majupečatljivijom zbirkom memoara.

Iz recenzija:

„Njen portret je biblijska studija života okruženog smrću.“

Džejms Boldvin

„Predivna knjiga – bezuslovno očaravajuća memoarska proza za naše i bilo koje drugo vreme… Maja Anđelou je rođena spisateljica sa razvijenim čulom za život, a ovo je njena izuzetna autobiografska priča.“

Kirkus rivju

„U svim svojim delima Maja Anđelou istražuje koncepte ličnog identiteta i ljudske istrajnosti iz perspektiva rase, pola, porodice, zajednice i kolektivne prošlosti.“

Njujork tajms

„Dirljiva priča o jednom nesvakidašnjem detinjstvu.“

Gardijan","znam-zasto-ptica-u-kavezu-peva-naslov-139863","Maja Anđelou"
"Komandant","850 rsd","https://www.korisnaknjiga.com/photo/books0119/p118810b0.jpg","Biografije, autobiografije, memoari",",,Komandant"" je knjiga o Ratku Mladiću, njegovoj umešnosti u komandovanju, sa ciljem da se osvetli njegov obraz i da se odbace optužbe za genocid. Biografija generala, koju je sačinio istoričar dr Bojan Dimitrijević, u sebi sadrži mnoge osobenosti koje izmiču uobičajenom pogledu na njegov ratni put. 
S obzirom da je skoro osuđen na najdrastičniju moguću kaznu koju haški sud izriše, kao i nezavršenost istorijskih i političkih procesa, bavljenje njegovom biografijom značajno je danas više nego ikada. Ovo je smeo potez da se slika o čuvenom komandantu makar malo osvetli.","komandant-naslov-118810","Bojan Dimitrijević"
"Ja, Pink Panter: Ispovest","990 rsd","https://www.korisnaknjiga.com/photo/books0083/p082880b0.jpg","Biografije, autobiografije, memoari","Pink Panter – Moja zatvorska ispovest jeste iskrena priča Olivere Ćirković o svom životu, žrtvama i patnji. Olivera iznosi bolnu istinu o tome kako je ostala bez slobode i prava na istinu jer je verovala u ljude i svet.
Ona piše o vremenu raspada Jugoslavije, o istoriji zabluda i snova njene generacije. Olivera je bila odlična košarkašica, a završila je iza rešetaka. Bila je članica kriminalne grupe Pink Panter i u ovoj knjizi ona piše sve o svom životnom putu i da li je on bio nametnut ili ličan izbor.","ja-pink-panter-ispovest-naslov-82880","Olivera Ćirković"
"Iz dubina","700 rsd","https://www.korisnaknjiga.com/photo/books0083/p082318c0.jpg","Biografije, autobiografije, memoari","Roman Iza dubina pokazuje koja istina se krije iza hrišćanske pesme i himne Amazing Grace (Zadivljujuća milost). Himnu je napisao Džon Njutn nakon što ga je Božja milost izvukla iz kandži  ponora, trgovine robljem i moralnog posrnuća. Himna je napisana po istinitoj priči o osobi koja je spasena uz Božju volju i milost.","iz-dubina-naslov-82318","Džon Njutn"
"Knjiga života","5.374 rsd","https://www.korisnaknjiga.com/photo/books0055/p054171c0.jpg","Biografije, autobiografije, memoari","Knjiga života maestralan je krešendo trilogije All souls u kojem su vještice, vampiri i demoni prikazani dojmljivo trodimenzionalno, roman prepun strasti koji govori o nama danas i vječnoj ljubavi za kojom svatko traga. S više od milijun primjeraka prodanih samo u Sjedinjenim Američkim Državama i s prijevodima na trideset četiri jezika trilogija Deborah Harkness jedan je od najuspješnijih serijala proteklih godina.","knjiga-zivota-naslov-54171","Debora Harknes"
"Lauš","890 rsd","https://www.korisnaknjiga.com/photo/books0243/p242462b0.jpg","Biografije, autobiografije, memoari","“Lauš” Borisa Jakića je emotivna i dokumentarna priča o životu i karijeri jednog od najharizmatičnijih glumaca s prostora bivše Jugoslavije – Žarka Lauševića. 

Knjiga se bavi svim ključnim momentima njegovog života: od detinjstva i glumačkih početaka, preko njegovog vrtoglavog uspona do zvezda, do mračnog preokreta u jednoj tragičnoj noći koja ga je odvela iza rešetaka i naterala u egzil. Kroz svedočenja kolega, prijatelja, reditelja i ljudi koji su ga poznavali, Jakić pokušava da prikaže kompletnu ličnost Lauševića – kao šarmantnog i talentovanog umetnika, ali i čoveka koji je morao da se nosi sa ličnim demonima i posledicama svojih postupaka.

Posebnu vrednost knjizi daju dosad neobjavljene fotografije iz njegovog detinjstva, kao i porodične uspomene, uključujući detalje o njegovom odnosu s bratom Branimirem, s kojim deli deo teške životne sudbine. Jakić uspeva da kroz priču o Lauševiću dočara snagu umetnosti i prijateljstva, naglašavajući da, čak i kada život donosi tragedije, ostaju dela, uspomene i uticaj na one koji su ga poznavali i voleli. 

“Lauš” nije samo biografija, već i omaž umetniku čiji je sjaj trajao i kroz najteže trenutke. Kroz ovaj narativ, čitalac dobija priliku da zaviri iza scene u život čoveka koji je, uprkos svemu, ostao legenda domaće kinematografije i pozorišta.","laus-naslov-242462","Boris Jakić"
"Žitije protopopa Avakuma, koje je on sam napisao","440 rsd","https://www.korisnaknjiga.com/photo/books0144/p143836c0.jpg","Biografije, autobiografije, memoari","Protopop Avakum se protivio reformama patrijarha Nikona, pa ga je ruski car prognao u Sibir. Poslednjih četrnaest godina života bio je zatočen u tvrđavi u Pustozjorsku na Pečori gde je pisao Žitije, prvu autobiografiju ruske književnosti prepunu realističkim opažanjima.","zitije-protopopa-avakuma-koje-je-on-sam-napisao-naslov-143836","Avakum Petrovič"
"Pismo ocu","653 rsd","https://www.korisnaknjiga.com/photo/books0022/p021780b0.jpg","Biografije, autobiografije, memoari","Pred nama je, verovatno, najčuvenije pismo u književnosti dvadesetog veka. Na sedamdeset tri stranice napisao ga je Kafka ocu, u trenutku kad je bio neposredno pod uticajem neostvarene ljubavne veze, za koju on okrivljuje i oca, ali je ovo pismo, zapravo, trebalo da bude i objašnjenje za njihov mučan i bolan odnos. Tekst pisma Kafka je imao u odštampanoj verziji, što ukazuje da je sam pisac prepoznao književnu vrednost teksta i njegovu aktuelnost i univerzalnost. Ovo pismo, koje Kafka nekoliko puta spominje u pismima Mileni Jesenskoj, pisac je dugo želeo da napiše. Odnos Hermana Kafke prema Francu oblikovan je tradicionalnim očekivanjima uspešnog poslovnog čoveka od jedinog sina i naslednika. On odgovara tipičnom, za patrijarhalne odnose, konfliktu oca i sina u novonastaloj srednjoj klasi koja je u toku kratkog vremena doživela odlučujuće promene.Kristof Štecl na primeru odnosa Hermana Kafke i njegovog sina dolazi do sledećih zaključaka: ""Sukob između Hermana Kafke i Franca Kafke je nepremostiv sukob između dve jevrejske generacije, koji je mučan upravo zbog toga što obojica, otac i sin, predstavljaju tipove ekstremno uzdignutih osoba iznad onih koji su tipični za generaciju"". Ovo izdanje na našem jeziku od posebne je važnosti, jer je obogaćeno i iscrpnim pogovorom i napomenama, koji detaljno tumače samo pismo, kao i Kafkin spisateljski i lični život. Ovo Kafkino Pismo ocu, kao i da je pismo svetu koje piše Kafka, koji je, uprkos genijalanosti, čitavog života bio svuda i na svakom mestu, pa i u porodici - stranac. No, roman pod tim naslovom, napisaće jedan drugi čovek, Alber Kami, koji je baš kao i Kafka bio vazda ""ni miran, ni srećan, ni veseo"".","pismo-ocu-naslov-21780","Franc Kafka"
"Niko se odavde neće izvući živ","839 rsd","https://www.korisnaknjiga.com/photo/books0206/p205103b0.jpg","Biografije, autobiografije, memoari","Biografija muzičara Džima Morisona i grupe Dors.

Iz recenzija:

„Uznemirujuća priča o psihičkoj nestabilnosti jednog umetnika. Temeljna, provokativna i krajnje saosećajna.“

Baltimore Sun

„Obavezno štivo za svakog obožavaoca grupe Dors prepuno pikantnih otkrića, gorko-slatkih uspomena i iscrpnog istraživanja Morisonove bizarne propasti.“

Los Angeles Times

„Briljantno... Vrlo živopisan, divlje zanosan prikaz jednog kratkog života proživljenog na ivici, ma preko ivice. Jedna bezbožna vožnja, surovo putovanje kroz mračnu stranu ljudske prirode. Savršena knjiga. Napisana onom vrstom robusne perfekcije kakvu bi Morison znao da ceni. Pročitajte.“

Kicks

„Fantastično! Niko se odavde neće izvući živ probudiće vam nostalgiju za tim furioznim vremenom nabijenim strastima, koje je prebrzo prošlo. Ova knjiga je dokument, a ne tek još jedna biografija pale zvezde.“

Nashville Gazette","niko-se-odavde-nece-izvuci-ziv-naslov-205103","Džeri Hopkins, Deni Šugermen"
"Nikola Tesla: Romansirana biografija","963 rsd","https://www.korisnaknjiga.com/photo/books0186/p185802b0.jpg","Biografije, autobiografije, memoari","Biografija je pisana razumljivim i jednostavnim jezikom. Autor se u ovom delu osvrće i na Teslin inovatorski rad.","nikola-tesla-romansirana-biografija-naslov-185802","Artur Bekhard"
"Hitler - slika tiranije, 1-3","3.299 rsd","https://www.korisnaknjiga.com/photo/books0243/p242332b0.jpg","Biografije, autobiografije, memoari","""Hitler - slika tiranije, 1-3"" Alana Buloka predstavlja sveobuhvatno istraživanje života i uspona Adolfa Hitlera, jednog od najkontroverznijih i najpogubnijih vođa u svetskoj istoriji. Kroz tri dela, Bulok analizira Hitlerovu transformaciju iz političkog autsajdera u brutalnog diktatora, istražujući istorijske okolnosti, političke borbe i ideološke previranja koja su omogućila njegov dolazak na vlast.

Prvi deo prati rane godine Hitlerovog uspona i unutrašnje borbe koje su ga dovele do vrha nemačke politike, otkrivajući početke katastrofe koja će se ubrzo obrušiti na svet. Drugi deo istražuje period od preuzimanja funkcije kancelara do aneksije susednih teritorija, prikazujući rađanje diktatora tokom kratkotrajnog mira i ekspanziju Nemačke koja vodi ka ratu. Završni deo detaljno prati Hitlerove megalomanske ratne ambicije i posledice koje su ostavile svet u ruševinama – od prvih vojnih uspeha do konačnog poraza, gde ostaju samo smrt i razaranja kao njegovo jedino nasleđe.

Alan Bulok, ugledni profesor sa Oksforda, kroz precizno istraživanje i bogate istorijske uvide pruža ne samo analizu Hitlerove ličnosti već i razumevanje političkih i društvenih okolnosti koje su oblikovale jednu od najmračnijih epoha modernog doba. Ova trilogija predstavlja esencijalno štivo za sve zainteresovane za razumijevanje dinamike moći, istorije totalitarizma i razaranja koje takva vlast može doneti.","hitler-slika-tiranije-1-3-naslov-242332","Alan Bulok"
"Nije bilo uzaludno","950 rsd","https://www.korisnaknjiga.com/photo/books0243/p242200b0.jpg","Biografije, autobiografije, memoari","Knjiga ""Nije bilo uzaludno"" autora Milovana Bojića predstavlja izuzetno intimnu i inspirativnu autobiografiju jednog od najpoznatijih srpskih lekara i političara. 

Ova knjiga osvetljava životnu putanju autora, od njegovog detinjstva u malom selu Lipovu, preko medicinskih studija i uspona u karijeri, do ključnih trenutaka kada je postao jedan od vodećih stručnjaka u oblasti kardiologije i prepoznat na svetskoj sceni zahvaljujući svom radu u Institutu „Dedinje“.

Bojić počinje svoju priču slikajući svoje skromno detinjstvo u ruralnoj sredini, gde su se oblikovali njegovi temelji vrednosti – rad, upornost i humanost. On detaljno opisuje svoj put kroz medicinske studije, osvetljavajući izazove s kojima se suočavao, ali i strast i posvećenost kojima je pristupao svojoj profesiji. 

Njegova ljubav prema medicini i nauci vodi ga do pozicije jednog od najvažnijih lidera u oblasti srčane hirurgije, gde je uspeo da Institut „Dedinje“ postane jedan od najprestižnijih centara za lečenje srčanih bolesti, ne samo u Srbiji, već i u svetu.

U knjizi, Bojić takođe progovara o svojoj političkoj karijeri, uključujući period kada je obavljao funkciju ministra zdravlja. Autor sa velikom iskrenošću opisuje izazove sa kojima se suočavao tokom tog perioda, uključujući političke pritiske i teške odluke koje su često imale dalekosežne posledice po zdravstveni sistem Srbije. Njegova borba da unapredi srpsko zdravstvo, uprkos političkim turbulencijama, prikazana je kroz prizmu humanizma, koji je Bojić postavio kao temelj svoje medicinske i političke prakse.

""Nije bilo uzaludno"" nije samo autobiografija jednog čoveka, već i svedočanstvo o vremenu u kojem je srpsko zdravstvo prolazilo kroz značajne promene. Bojić deli svoja iskustva i misli o reformama koje je sproveo, o svom radu na unapređenju medicinske prakse u zemlji, kao i o tome kako je balansirao između medicine i politike u trenucima kada su ti svetovi često bili u sukobu.

Ova knjiga pruža uvid u čoveka koji je ne samo revolucionisao srčanu medicinu u Srbiji, već je i svojim primerom pokazao kako se kroz posvećen rad i viziju može ostvariti dugotrajan uticaj. Bojićeva priča služi kao inspiracija, ne samo medicinskim stručnjacima, već i svima koji veruju da je moguće ostaviti značajan trag u društvu, čak i u najtežim okolnostima.

""Nije bilo uzaludno"" je dirljivo, iskreno i inspirativno svedočanstvo o upornosti, posvećenosti i borbi za humanizam u medicini i politici, prikazano kroz oči jednog od najvažnijih aktera u srpskoj medicinskoj istoriji.","nije-bilo-uzaludno-naslov-242200","Milovan Bojić"
"Stid","891 rsd","https://www.korisnaknjiga.com/photo/books0243/p242194b0.jpg","Biografije, autobiografije, memoari","Knjiga ""Stid"" autorke Ani Erno predstavlja duboko intimno istraživanje emocije koja oblikuje ljudsko postojanje – stida. 

Počinjući dramatičnom rečenicom, „Jedne junske nedelje, rano po podne, otac je hteo da ubije majku,” roman nas uvodi u svet koji je istovremeno ličan i univerzalan. Ovaj autobiografski inspirisan roman prožet je stvarnim događajem iz autorkinog života, što čini njegovo pripovedanje sirovim i iskrenim, dok Erno kroz književnost oblikuje to iskustvo u složenu emocionalnu mapu univerzalnih osećanja.

Pripovedačica je zrela žena koja se vraća u vreme svog detinjstva, tražeći koren osećaja stida koji ju je progonio tokom celog života. Kroz detaljno sećanje na svoje odrastanje u malom gradu, ona se suočava sa stidom zbog svog porekla, porodice, doma i okruženja. Erno majstorski oslikava suptilne razlike između društvenih klasa i kako one mogu da obeleže devojčicu koja je, upijajući svet oko sebe, shvatila svoj položaj na margini.

Stid postaje ne samo emotivni teret koji je pripovedačica nosila kroz svoje odrastanje, već i pokretač njenog nastojanja da se izdigne iznad svojih korena. Kontrast između siromašnog detinjstva i aspiracija ka obrazovanju i boljem životu postavlja centralno pitanje romana: koliko daleko može otići osoba u pokušaju da se oslobodi onoga što je stidi?

Ani Erno, kroz jednostavan ali snažan jezik, vešto kombinuje lično i kolektivno, stvarajući univerzalnu priču o stidu kao motivu koji nas može oblikovati, ali i osloboditi. ""Stid"" je introspektivni roman koji ispituje društvene nepravde, identitet, poreklo i kako se te duboko usađene emocije prenose kroz život, uvek prisutne, čak i kada postignemo ono o čemu smo sanjali.","stid-naslov-242194","Ani Erno"
"Dijalog o Zlu i Dobru","799 rsd","https://www.korisnaknjiga.com/photo/books0242/p241936b0.jpg","Biografije, autobiografije, memoari","Knjiga ""Dijalog o Zlu i Dobru"" pisaca Đorđa Lebovića i Zlate Lebović Jakovljević nudi duboku refleksiju o ljudskoj prirodi, moralu i borbi između dobra i zla kroz prizmu jednog od najmračnijih perioda u istoriji čovečanstva – holokausta. Ovaj fascinantni dijalog između pisca i preživelog logoraša Đorđa Lebovića i njegove supruge, glumice Zlate Lebović Jakovljević, donosi intimna razmišljanja o njegovom iskustvu u nacističkim logorima, o načinima na koje je zlo oblikovalo njegov život, ali i o snazi dobrote koja se pojavljuje čak i u najstrašnijim okolnostima.

Kroz razgovore, otkrivaju se nepoznati detalji iz Đorđevog detinjstva, njegovog traumatičnog odrastanja u doba rata, i procesa nastajanja njegovih antologijskih dela. Ova knjiga ne samo da je svedočanstvo o preživljavanju, već i duboka analiza o suštinskom značenju dobrote i humanosti u svetu prepunom nepravde i nasilja. Zlata Lebović Jakovljević, kao Đorđeva životna saputnica, unosi u razgovore jedinstven pogled i postavlja ključna pitanja koja omogućavaju dublje razumevanje Đorđevih stavova i dela.

""Dijalog o Zlu i Dobru"" je knjiga koja podseća na tragične ljudske sudbine u teškim vremenima, ali i slavi ljudsku sposobnost da izabere dobrotu, čak i kada je okružena najvećim zlom. Ovaj neprocenjivi portret jednog života i umetničkog stvaralaštva pruža dragocenu lekciju o snazi vere u bolje sutra.","dijalog-o-zlu-i-dobru-naslov-241936","Đorđe Lebović, Zlata Lebović Jakovljević"
"Stephen King: Sveobuhvatno istraživanje njegovog rada, života i uticaja","4.990 rsd","https://www.korisnaknjiga.com/photo/books0242/p241917b0.jpg","Biografije, autobiografije, memoari","Knjiga ""Stephen King: Sveobuhvatno istraživanje njegovog rada, života i uticaja"" autora Bev Vinsenta vodi vas na jedinstveno putovanje kroz karijeru jednog od najuticajnijih pisaca današnjice. Ovaj sveobuhvatan vodič istražuje Kingovu gotovo pedesetogodišnju karijeru, osvetljavajući teme njegovih dela i događaje koji su oblikovali njegove romane, novele, pripovetke i filmske adaptacije.

Sa bogatstvom arhivskih fotografija i dokumenata iz lične kolekcije Stivena Kinga, ova knjiga nudi detaljan pregled iza kulisa stvaranja njegovih najpoznatijih dela poput ""Keri,"" ""Isijavanja,"" ""To"" i ""Bekstva iz Šošenka"". Otkrijte manje poznate priče, izazove i trijumfe koji su oblikovali karijeru ovog neosporno talentovanog autora, kao i uticaj koji je ostavio na popularnu kulturu i književnost.

Bilo da ste dugogodišnji fan ""kralja horora"" ili tek počinjete da otkrivate njegove radove, ova knjiga je idealan dodatak za vašu kolekciju. Upustite se u informativno i uzbudljivo istraživanje dela koja su decenijama oblikovala žanr horora i fantastike.","stephen-king-sveobuhvatno-istrazivanje-njegovog-rada-zivota-i-uticaja-naslov-241917","Bev Vinsent"
